review_content,date,overall_rating,food,service,ambiance,restaurant,timestamp
We had a great lunch! Food was yummy! Highly recommend the lasagna and bib lettuce salad.,"Dined on May 18, 2024",5,5,5,5,the-pink-door,2024-05-18
"This place is very cool. Unassuming from the Pink door entrance, the ambience hits you from the moment you open the door and step into the landing at the top of the stairs. We wound though the restaurant and sat at a table with a beautiful view of the water. Our waitress was spunky and well informed. She helped lead us to some fantastic dishes which we shared. The Pink Door Lasagna was amazing and pair well with an order of meatballs. The Linguini Alle Vongole was excelent. We also ordered the Oysters on the half shell, and for dessert the Rhubarb and Donut holes (they both had better names but I don't recall them). Everything was just fantastic! We booked a month in advance and had to settle for 9pm, but with the view and ambience as the sun went down the timing was perfect.
Read more","Dined on May 18, 2024",5,5,5,5,the-pink-door,2024-05-18
"The team, the food, and the ambience are the best, as always.","Dined on May 18, 2024",5,5,5,5,the-pink-door,2024-05-18
Great place and location. Food was meh. Server just messed up the order a couple of times,"Dined on May 18, 2024",5,2,2,5,the-pink-door,2024-05-18
Great food and service. We will go back again. So many gluten free options,"Dined on May 18, 2024",5,5,5,5,the-pink-door,2024-05-18
"Lunch or dinner at The Pink Door is always a treat, and my experience yesterday for a late lunch out on their patio was no exception.

The food - linguini vongole, arancini, spring risotto, and a glass of sauvignon blanc was excellent.

The service was friendly, knowledgable, and energetic.

This restaurant has long been one of my favorites, and I cannot recommend it more highly.
Read more","Dined on May 18, 2024",5,5,5,5,the-pink-door,2024-05-18
"Dominik was awesome! He created  a great experience for us!
The food was amazing, highly recommend!","Dined on May 17, 2024",5,5,5,5,the-pink-door,2024-05-17
"What a great experience! We listened to live music and enjoyed the ambience. Food was great and the wine was reasonably priced. Definitely suggest making a reservation. We showed up a little early but they sat us right away. We heard people talking the following day how they were trying to burn time in the hopes the restaurant would slow down and an opening would become available.
Read more","Dined on May 17, 2024",5,4,5,5,the-pink-door,2024-05-17
"We've been experiencing The Pink Door for more than 30 years and it remains our very favorite Seattle restaurant. Ever. From atmosphere to food to service, all of it. May its door never close. Long live The Pink!","Dined on May 17, 2024",5,5,5,5,the-pink-door,2024-05-17
"Food choices were varied. I tried the Pink Door Lasagna , Phenomenal !!  the Spring risotto, the linguine were some of our favorites  Our party of 8 tried several appetizers all were terrific. Drinks were spot on. Beautiful restaurant and perfect place to start our Seattle vacation. Hardest part was finding it! You simply can not go wrong with this restaurant . every dish was delicious and the staff are the best
Read more","Dined on May 17, 2024",1,1,1,1,the-pink-door,2024-05-17
"Great experience the risotto and fish of the day was to die for! Amazing, extraordinary, fresh local flavors! The  views and ambiance were also unique!","Dined on May 17, 2024",5,5,5,5,the-pink-door,2024-05-17
"This place is everything.  And it all starts with a mysterious pink door with no name.  We got there right before 1130 and the place was already garnering a line.  I thought all of us were going to rush the insides when the door opened.  And when it opened. What a delight.  Like opening a jewel box lid and seeing all the sun sparkled gilt and oil paintings and friendly staff.  The view in the back of the giant ferris wheel and the water is to die for.  And then to eat ... in those rooms .. with that view.. and the attentive, laid back staff.  The sweet/crisp/bright green/tender butterbean lettuce salad was so vibrant with flavor and greenness.  Butterbeans remind me of my grandmother.  And these were clearly from a nearby farm. The fish - grilled to perfection over a bed of crisped potatoes and greens.  The rhubarb pavlova - a tangy pink delight draped over a giant cloud of meringue.  A true slice of heaven.  Cant recommend enough!!  A favorite meal of a lifetime!
Read more","Dined on May 16, 2024",5,5,5,5,the-pink-door,2024-05-16
"Fantastic experience!  Our server Ryan was the best.  If you dine there, must sit in the back with a view of the water.  All entre’s are very reasonably priced.  Will be back in June.
Thank you Pink Door.
Mark
Read more","Dined on May 16, 2024",5,5,5,5,the-pink-door,2024-05-16
"This was my first time at he the Pink Door.  Not sure why I waited so long, it is a wonderful place with amazing food and outstanding service.  Had a table for two at the window, the view was spectacular at sunset.  We tried a little bit of everything on the dinner menu and it was all fantastic.  the tuna crudo melts in your mouth, the pasta course was cooked perfectly, the lamb chops were served rare and were crave worthy.  Also tried three of the deserts and they were all delicious.  Best dining experience in the Market area that I had had in a while, Well done Pink Door, keep it up, we will be back soon
Read more","Dined on May 16, 2024",5,5,5,5,the-pink-door,2024-05-16
Favorite place to eat in Seattle. Love the lasagna. Favorite lasagna I have found in the US.,"Dined on May 16, 2024",5,5,5,5,the-pink-door,2024-05-16
Would live to have been seated outside but a very good experience overall.,"Dined on May 16, 2024",5,5,4,4,the-pink-door,2024-05-16
Perfect sunny afternoon lunch on the deck. Heaven!,"Dined on May 16, 2024",5,5,5,5,the-pink-door,2024-05-16
Great food.  Wonderful flavors. Super service. One of our favorite places.,"Dined on May 15, 2024",5,5,5,5,the-pink-door,2024-05-15
"One of the two entrees was badly oversalted. Even my salt-loving daughter agreed. I could have sent it back, but that would have ruined the timing of the lunch.","Dined on May 15, 2024",4,3,4,5,the-pink-door,2024-05-15
It’s always an amazing time when we come. The risotto has been on my mind for weeks and did not disappoint.  The staff is so sweet and accommodating.,"Dined on May 12, 2024",5,5,5,5,the-pink-door,2024-05-12
"I love the Pink Door. Celebrating Mother's Day with my daughter and her friend that just lost her Mother. Everything was great except our waiter. I had a gift card and also paid with my credit card. I made the mistake of my tipping on the credit card not the entire  amount because I was busy talking to the girls.  I am a very good tipper, he kept coming over asking about the service and when we left stared at me in a rude way. After we left I realized what I did, that still was did not a good reason for his rudeness.
Read more","Dined on May 12, 2024",5,5,2,5,the-pink-door,2024-05-12
Expérience exceptionnelle. Repas délicieux dans un environnement sympathique.,"Dined on May 12, 2024",5,5,5,5,the-pink-door,2024-05-12
Thank you for another wonderful dining experience on your deck. The service was very professional and highly competent. Every dish was enjoyed. The burrata and prosciutto appetizer is not to be missed. The halibut was cooked to perfection. The cioppino looked amazing. But save room for rhubarb pavlova. A perfect ending.,"Dined on May 12, 2024",5,5,5,5,the-pink-door,2024-05-12
We ate on the patio on a beautiful day!  It was perfect. Service is exceptional (thank you Dan). Food is delicious. A wonderful lunch with family!,"Dined on May 11, 2024",5,5,5,5,the-pink-door,2024-05-11
Wonderful meal. Make reservations long in advance of coming to Seattle. Eclectic interior. Beautiful view of the sea. Our waiter was excellent. Good wax too. 4 in our party. All 4 different tastes. Lots of menu items to choose from. Will be back! Don’t miss this gem!,"Dined on May 11, 2024",5,5,5,5,the-pink-door,2024-05-11
I’ve been trying to get a reservation here for years (out of towner) I finally came for my birthday weekend with my husband and it did not disappoint.,"Dined on May 11, 2024",5,5,5,5,the-pink-door,2024-05-11
"For all you go through to get a reservation, the food actually should’ve been better… The advertisers were great, but the entrées seem to be pedestrian… The linguine clam sauce was very dry and didn’t have much in the way of interest… The meatballs were excellent but we’re not served with enough sauce. They gave us maybe a tablespoon of sauce. I understand the Italians don’t use a lot of sauce, but this wasn’t enough sauce, the majority of the pasta was dry.
￼ the space is lovely and the service was excellent, but at the end of the day you go out to dinner for the food and I don’t think it added up
Read more","Dined on May 11, 2024",4,3,5,5,the-pink-door,2024-05-11
Service was amazing 🤩. I enjoyed the eclectic atmosphere. Food was top notch! Very good value for such an exclusive restaurant.,"Dined on May 11, 2024",5,5,5,5,the-pink-door,2024-05-11
"The Pink Door never disappoints.  Great food, great service, great location.  If it your first time, I recommend starting with the Tuna Crudo appetizer, and then the Lasagna entree.  But even if these don't appeal to you, you can't go wrong with the other selections either.","Dined on May 11, 2024",5,5,5,5,the-pink-door,2024-05-11
Excellent service and great food options as well as a view while you eat.,"Dined on May 10, 2024",5,5,5,5,the-pink-door,2024-05-10
Very lovely vibes. The interior design is fabulous and feels like you get transported to France. Staff was great and live music was awesome.,"Dined on May 10, 2024",5,5,5,5,the-pink-door,2024-05-10
It is very hard to get a reservation.  I don't think I would go without a reservation simply because we are older and not up to the wait.  I did get up at midnight to get a reasonable reservation time for 5.  I could only get 5:30.  It was worth it though.,"Dined on May 10, 2024",5,5,5,5,the-pink-door,2024-05-10
"Lasagna was perfect, as expected. Stellar service.","Dined on May 10, 2024",5,5,5,5,the-pink-door,2024-05-10
"Fantastic food, service and the best patio ever on a sunny day. Loved our meal.","Dined on May 9, 2024",5,5,5,5,the-pink-door,2024-05-09
The food excellent as always. The rhubarb pavlova delicious. Frederick our server excellent too,"Dined on May 5, 2024",5,5,5,5,the-pink-door,2024-05-05
Highly recommend.  If you can’t get reservations they do take walk ins but on Fri night the waitlist was closed by 7pm so arrive early. Service and food were excellent. We left before the entertainment started at 7pm. Arrive after 7 if you want that experience.  On Tu &Sat they have aerial acrobats.,"Dined on May 4, 2024",5,5,5,5,the-pink-door,2024-05-04
"Great service, scrumptious food with really nice ambience in a beautiful dining room with a glorious view of Elliot bay and the market..
Top notch!","Dined on May 4, 2024",5,5,5,5,the-pink-door,2024-05-04
"From beginning to end, it was a meal to remember! We had a large family gathering on the terrace, and the view, food, and service was impeccable.  Fresh oysters, anti-pasta, prosecco, clams, mussels, fish, meatballs....we felt as if we were dining in Italy! We had children with us and they thoroughly enjoyed the experience as well.  I cannot recommend The Pink Door highly enough. Much praise to Jackie for creating such an amazing restaurant, and to her daughter Angelica now at the helm.  Brava!
Read more","Dined on May 4, 2024",5,5,5,5,the-pink-door,2024-05-04
"My husband & I had an early dinner at the pink Door and felt it was worth the hype. We sat in the back dining room with the windows overlooking the water. The noise level was significantly lower than the front room. The ambience is eclectic which unique wall art & a mix of textiles. Our table was fabulous- we were in the corner by the windows.
Our waitress was excellent. Very friendly, professional & knowledgeable. We had Caesar salad, PAPPARDELLE AL RAGÙ BOLOGNESE & fish of the day. The bolognese was excellent. The Caesar salad was just ok - nothing special. The fish was cooked beautifully but it was served on lentils which were just ok.   WeI would definitely come back.
Read more","Dined on May 3, 2024",5,5,5,5,the-pink-door,2024-05-03
"Pink Door has been a Seattle favorite for decades; over the last few years, getting a reservation has been like getting an audience with the Pope. I understand that they have cut their reservations in order to ensure that they have room for walk-ins. I appreciate that. Just getting in is the biggest issue; otherwise, the food is terrific, the vibe has always been awesome, the service friendly...just great food in a casual, fun setting. Highly recommend if you can score a reservation, and probably worth the wait if you don't (they'll take your number, have you walk around Pike Place Market, and let you know when a table is opening up).
Read more","Dined on May 2, 2024",5,5,5,5,the-pink-door,2024-05-02
"Super cute place. Food was very good, but honestly, I think it’s so popular because of the ambience.","Dined on May 2, 2024",5,4,5,5,the-pink-door,2024-05-02
"The best Italian dining we’ve experienced outside of Italy!  Excellent and professional service, creative menu and healthy options make this a must visit in Seattle.  Topped off with a great wine selection, some at reasonable prices.  We had a really fantastic experience and would definitely return.","Dined on May 2, 2024",5,5,5,5,the-pink-door,2024-05-02
"I could be more pleased with my meal, the service, and the overall experience.","Dined on May 2, 2024",5,5,5,4,the-pink-door,2024-05-02
The food was amazing and our waitress Steph P was so nice. We had a blast celebrating a birthday and definitely plan to visit again soon.,"Dined on May 1, 2024",5,5,5,5,the-pink-door,2024-05-01
The fish of the day was amazing! The oysters were fabulous and the view was great!,"Dined on May 1, 2024",5,5,5,5,the-pink-door,2024-05-01
"Service was quick and the server checked in to see how we were doing several times, as well as provided some insight on the menu which is always appreciated. The ambience was beautiful and the food was delicious!","Dined on May 1, 2024",5,5,5,5,the-pink-door,2024-05-01
"Fantastic evening! Great cocktails, wine and food plus excellent service!  Love the space too!","Dined on April 28, 2024",5,5,5,5,the-pink-door,2024-04-28
The linguine was very good but the Halibut was not well seasoned.  The almond cake was just okay. They also don’t seem to have a sommelier to recommend wine but I suppose that’s not a big deal. The service was good and the the view is great.,"Dined on April 28, 2024",4,4,4,5,the-pink-door,2024-04-28
Well the stake wasn't that great (medium rear was well done). Next time I will order their specialty... Just pasta. The lasagna was great. Their dessert was average.,"Dined on April 28, 2024",4,4,5,5,the-pink-door,2024-04-28
"Eric was our server and he was lovely. The food was simply amazing. Atmosphere incredible. Half litter of wine for $20. When the bill came we were very pleasantly surprised!! 


First time in Seattle and an absolutely pleasure to be able to eat dinner here.
Read more","Dined on April 27, 2024",5,5,5,5,the-pink-door,2024-04-27
"Second time here and had a great time! Live band playing for about half the meal and although we were right next to the stage, it was really quite enjoyable! I would recommend walking in and trying for space if you don’t have a reservation, but I waitlisted on OpenTable and that worked!","Dined on April 27, 2024",4,4,5,4,the-pink-door,2024-04-27
"Food was amazing!  Fun atmosphere,  great service,  and so so yummy.","Dined on April 27, 2024",5,5,5,5,the-pink-door,2024-04-27
Great  food and service. Great ambiance. We will come back,"Dined on April 27, 2024",5,5,5,5,the-pink-door,2024-04-27
Amazing Lasagna and Arancini. Pavlova had subtle sweet but was complemented well with the rhubarb compote. Great experience 😀,"Dined on April 27, 2024",5,5,5,5,the-pink-door,2024-04-27
"We visited the Seattle area for our anniversary to experience the sites and National Parks. The Pink Door has great ambiance and delicious food. We got a half dozen oysters, the prosciutto and burrata, cioppino pink door, and a squid ink pasta with seafood. This was perfect for an anniversary week lunch to end our week long trip.","Dined on April 20, 2024",5,5,5,5,the-pink-door,2024-04-20
Our waiter Stephano gave great suggestions! Food was delicious and homemade. I really loved the “rose hips to my lips” drink. The man with the water pitcher was so on it my glass was never half empty. Props to him.,"Dined on April 19, 2024",5,5,5,5,the-pink-door,2024-04-19
"Hard to get in place but well worth it if you can find it.  Pink door on building in an alley is hard to find.  Open the door, and it’s a cavernous lively atmosphere, with good food and service.","Dined on April 17, 2024",5,5,5,5,the-pink-door,2024-04-17
"I visited earlier this week few a late lunch surprise. The team at the restaurant was fabulous!  They helped me to make it an incredibly special event. The service was impeccable, the setting was magical, and the food stupendous. We would highly recommend!","Dined on April 17, 2024",5,5,5,5,the-pink-door,2024-04-17
We have been coming to the restaurant for year and it never disappoints.  We had a table by the window and the view was awesome.  Our server appeared right when we needed him.  The food was sooo good.  Highly recommend reservations to this very popular spot.,"Dined on April 14, 2024",5,5,5,5,the-pink-door,2024-04-14
"Our server acted like he wanted to be anywhere but there. We told him about a birthday in our group and his comment was “ I don’t sing and dance” - we never asked him to do either. We observed other servers taking a small dessert with a candle to other guests and wishing them a happy birthday.  We were asking questions about the menu and he was obviously annoyed by that.  Sadly, the birthday girl in our group was so excited to eat here for her birthday dinner and we felt bad because while the food was amazing the service made us feel unwelcome and like we were inconveniencing our server by our mere presence.
Read more","Dined on April 14, 2024",4,5,1,5,the-pink-door,2024-04-14
Our server was great & the food and drinks were delicious.,"Dined on April 14, 2024",5,5,5,5,the-pink-door,2024-04-14
"Wonderful place to take friends from out of town. Great menu, welcoming service, nice vibes, and good drinks.  This place is Seattle in a microcosm.","Dined on April 13, 2024",5,5,5,5,the-pink-door,2024-04-13
Reallly enjoyed our experience here! The food was great! We really liked the fresh oysters and cioppino! The vibe of the place was cool too and there was a nice view of the water in the back room where we were seated!,"Dined on April 13, 2024",5,4,5,5,the-pink-door,2024-04-13
Great spot and amazing food! The pasta and wine is my favorite but also great seafood.,"Dined on April 13, 2024",5,5,5,5,the-pink-door,2024-04-13
"Simply amazing!! Food, service, atmosphere and value were incredible. Can’t wait to go back.","Dined on April 13, 2024",5,5,5,5,the-pink-door,2024-04-13
This maybe the best restaurant in Seattle.   The food and service are outstanding.,"Dined on April 13, 2024",5,5,5,5,the-pink-door,2024-04-13
I really enjoyed the quality of the restaurant! Behind a seemingly innocuous pink door with no signage lies a beautiful and relaxing Italian restaurant with high-quality pasta and wonderful service. I'd come back with a date next time!,"Dined on April 12, 2024",5,5,5,5,the-pink-door,2024-04-12
"Meal was excellent — our waitress was amazing, she did a fantastic job. We travelled from Arizona today and went straight from the airport to Pink Door, thanks again for making the trip worthwhile.","Dined on April 12, 2024",5,5,5,5,the-pink-door,2024-04-12
"We keeping coming back! Such a lovely restaurant and the menu is spot-on. Fine wines, a variety of appetizers, salads and entrees. Plus great service by all the staff. Thanks for making lunchtime so tasty!","Dined on April 12, 2024",5,5,5,5,the-pink-door,2024-04-12
"Service, food, and ambience were all great. I love the quirky decor too.","Dined on April 11, 2024",5,5,5,5,the-pink-door,2024-04-11
"The food was delicious, the service was excellent! Highly recommend the lasagna and the risotto!","Dined on April 11, 2024",5,5,5,5,the-pink-door,2024-04-11
We came for lunch as part of a work trip. It was Delish! Can’t wait to go back. 10/10!,"Dined on April 11, 2024",5,5,5,5,the-pink-door,2024-04-11
"Rarely does a restaurant experience go so far above and beyond my expectations that I feel I have so much to write about every single part of the experience. We made a reservation for the pink door because we had heard it was a can’t miss Seattle experience. The novelty of seeing an aerial performance during dinner was the initial draw and it did not disappoint, but the service, food, and ambiance were also excellent. Our server Elyse took excellent care of us and took special care to find a wine that fit our taste. The roasted beet ravioli and artichoke pasta were both amazing and so different from anything we had eaten before. The ambiance was perfect for a romantic dinner. It was packed but we could still hear each other perfectly. We managed to see 3 of the 4 aerial performances for the evening and they were all stunning and unique. I cannot recommend this restaurant enough!
Read more","Dined on April 10, 2024",5,5,5,5,the-pink-door,2024-04-10
Great dining experience and amazing food. Be sure to make a reservation weeks in advance. Had to make a reservation a month in advance even for a Tuesday evening!,"Dined on April 10, 2024",5,5,5,5,the-pink-door,2024-04-10
"Good was really good, service was amazing, felt very taken care of. Would’ve liked to sit near the window, but wasn’t too upset about that. Would definitely go again!","Dined on April 10, 2024",5,5,5,5,the-pink-door,2024-04-10
"Such a wonderful experience with amazing views and just a great vibe.  The food was delicious … the menu is small but well thought out.
Service is excellent and attentive without being smarmy.
The almond cake with cherries is worth the trip.
Read more","Dined on April 7, 2024",5,4,5,5,the-pink-door,2024-04-07
We had a fabulous dinner. This place is not overrated at all! The Ahi tuna crudo is a MUST. The everything green salad was great. The spring risotto and halibut special were both delicious. Expresso martinis were dark & rich. The decor and ambiance is great. Love it!,"Dined on April 7, 2024",5,5,5,5,the-pink-door,2024-04-07
"Excellent food, beautiful views, and great customer service.","Dined on April 7, 2024",5,5,5,5,the-pink-door,2024-04-07
"Had the chance to celebrate my birthday on the first trip to Seattle at the Pink Door with my boyfriend. The ambiance was perfect with the live jazz performance and the food matched the vibe. The restaurant has a speakeasy feel, would highly recommend coming during the performance times during dinner.","Dined on April 6, 2024",5,5,5,5,the-pink-door,2024-04-06
"After 15 years, I returned to an old favorite. The lasagna was just as good as it used to be, yet the service was even better. We had oysters, gnocchi, lasagna Pink Door, and red wine. We had a great table and so much fun. They called me right away when I accidentally left my purse, and everything was still in it. I am so grateful! Worth every penny!","Dined on April 6, 2024",5,5,5,5,the-pink-door,2024-04-06
The decor is great! Our food was excellent! Great service!,"Dined on April 6, 2024",5,5,5,5,the-pink-door,2024-04-06
"Wonderful as always - excellent, attentive service, great recommendations, everything prepared perfectly.","Dined on April 5, 2024",5,5,5,5,the-pink-door,2024-04-05
"This was such a highlight of our trip! Excellent service, wonderful views, absolutely amazing food - will definitely be back!","Dined on April 5, 2024",5,5,5,5,the-pink-door,2024-04-05
"Always a wonderful experience here when I’m in Seattle. The food is amazing, staff is super professional and nice. Make a reservation if you want to go it’s literally sometimes impossible. Walk in maybe a wait but it’s worth it.","Dined on April 5, 2024",5,5,5,5,the-pink-door,2024-04-05
"We ate in the main dining room overlooking Puget Sound, so the excellent jazz trio playing in the bar provided background music. The staff is engaging, sophisticated and professional. The food was excellent, the wine list carefully selected.","Dined on April 4, 2024",5,5,5,5,the-pink-door,2024-04-04
"Just above the tourist destination this gem is unassuming until you make your way past the host stand through the restaurant to the main dining room. We were seated I. The middle of the room with a stellar view of the sunset and ferry boats going to and from. The service was outstanding. Very attentive but not intrusive. Perfect recommendations and handled our allergies with respect and care. Even the chef triple checked before sending our order to our table! Highly recommend this place. Bolognese, cioppino, mama’s meatballs, oysters, bottle of bubbles and lemon tart for dessert.
Read more","Dined on April 4, 2024",5,5,5,5,the-pink-door,2024-04-04
