review_content,date,overall_rating,food,service,ambiance,restaurant,timestamp
"Amazing food and atmosphere. The aerial show was amazing, would have liked to get a short video but I understand why they don’t want everyone’s phones out. Very glad we went","Dined on October 18, 2023",5,5,5,5,the-pink-door,2023-10-18
Phenomenal meal from start to finish ! Highly recommend the arancini and lasagna,"Dined on October 18, 2023",5,5,5,5,the-pink-door,2023-10-18
"Busy venue, excellent food. Was seated next to ocean view windows which was a plus. Everything was very reasonably priced and delicious. Would recommend and return next time we are in SEA. Perfect evening ❤️","Dined on October 18, 2023",5,5,5,5,the-pink-door,2023-10-18
Always outstanding! An exceptional dining experience every time!,"Dined on October 18, 2023",5,5,5,5,the-pink-door,2023-10-18
"Great ambiance, very good food and excellent service.  PD has lots of energy and as always a wonderful place to have a meal","Dined on October 18, 2023",5,5,5,5,the-pink-door,2023-10-18
"Terrific location, lovely service and fantastic food","Dined on October 18, 2023",4,4,5,4,the-pink-door,2023-10-18
"Our sever & food was awesome! The only complaint I have is I booked for standard seating assuming it wouldn’t have been front row seats of a dancer with her legs coming near our head & bright lights facing our table. She was a good dancer, but I would of preferred if the hostess asked if that table would have been okay.","Dined on October 15, 2023",3,4,4,2,the-pink-door,2023-10-15
Lasagna was great. The whole experience was wonderful. For a wonderful evening we highly recommend it.,"Dined on October 15, 2023",5,5,5,5,the-pink-door,2023-10-15
Great place - must visit meal if you are in Seattle !,"Dined on October 15, 2023",5,5,5,4,the-pink-door,2023-10-15
"The quality, presentation and taste of the food was better than most places we’ve tried. We had the halibut, vegetarian lasagna and pappardelle pasta. Portions are small but definitely delicious and full of flavor. You must have the herbed fries, they’re sinfully good. A hidden gem inside an alley. Look for a peach door and enter the staircase to the check in area.","Dined on October 15, 2023",4,5,4,5,the-pink-door,2023-10-15
Wonderful birthday lunch! Surprised by our view of the water and the wheel. Food was delicious.. we were even 15 minutes late for our reservation and they were very accommodating.,"Dined on October 15, 2023",5,5,4,5,the-pink-door,2023-10-15
The food and service is wonderful.  Definitely recommend the lasagna and the branzino.  Right near the market.  Great Seattle experience.,"Dined on October 15, 2023",5,5,5,5,the-pink-door,2023-10-15
Absolutely fabulous! We were in Seattle for few days and could only get 11:30 am reservations. It was soo great. Food was amazing..wine delicious service great.,"Dined on October 14, 2023",5,5,5,5,the-pink-door,2023-10-14
"Amazing food
Amazing service 
Amazing place
Amazing
Read more","Dined on October 14, 2023",5,5,5,5,the-pink-door,2023-10-14
"Everything was amazing at this restaurant! From the apps (rice balls and antipasto plate), meals (Bolognese, chicken, seafood bowl, and halibut) were superb!","Dined on October 14, 2023",5,5,5,5,the-pink-door,2023-10-14
"the food was wonderful. Beet salad, fab, big serving, sharable. 
Wild mushroom pasta and lasagna were very nice and the roasted butternut risotto was wonderful as well.","Dined on October 14, 2023",5,5,5,5,the-pink-door,2023-10-14
"Vibe: 4/5
Drinks: 4/5
Appetizer: 4/5
Pasta: 3/5

It didn't really lift up to the hype. Will pass.
Read more","Dined on October 7, 2023",3,3,2,4,the-pink-door,2023-10-07
Fabulous as always! And our waiter Ryan was  excellent!,"Dined on October 7, 2023",5,5,5,5,the-pink-door,2023-10-07
"Everything about the Pink Door was incredible. The ambiance, the service, the food, and the location. We had early reservations and they were completely booked for the evening. Despite that we never felt rushed or that they were in a hurry to get us to leave. Their marinara sauce is the best thing I have ever put in my mouth. Our waiter told us it was an old recipe and something made in house. I wish we could have seen or heard the entertainment, but our reservations were too early. It was an amazing experience and I’m so glad we went.
Read more","Dined on October 7, 2023",5,5,5,5,the-pink-door,2023-10-07
"The food and scenery was outstanding! The server who served our table seemed disinterested and not very welcoming, but other staff members were great. Overall very enjoyable experience","Dined on October 7, 2023",4,5,2,5,the-pink-door,2023-10-07
"Delicious, fun and vibrant! Only got a lunch reservation but can imagine how fun dinner would be. Definitely will be back 🤩","Dined on October 7, 2023",5,5,5,5,the-pink-door,2023-10-07
Food quality ok. Portions average. Service was poor too many tables for one waiter. Very disappointed with this restaurant I heard great things about it but not good my pasta was cold and no good.,"Dined on October 7, 2023",3,2,3,3,the-pink-door,2023-10-07
By far the best Italian food we have ever had in Seattle. Amazing ambience and great service. Highly recommend.,"Dined on October 7, 2023",5,5,5,5,the-pink-door,2023-10-07
Such a great atmosphere. All 4 of us enjoyed our entrees,"Dined on October 6, 2023",5,5,5,5,the-pink-door,2023-10-06
"It was great. The view was good, ambiance was nice, but there was no live performance on Thursday.
Also, limited vegetarian/vegan options.","Dined on October 6, 2023",4,4,5,5,the-pink-door,2023-10-06
"The Pink Door is always great, favorite place to visit when in Seattle!","Dined on October 6, 2023",5,5,5,5,the-pink-door,2023-10-06
"Went for lunch on a weekday. Quickly filled up. Great location and cool interior … much larger than it looks from the outside. I had the cioppino, which was excellent though not the best I ever had (Alioto’s in SF). Good wine selection, teas, coffees. I had a dessert wine I never had before. Waitress was very helpful. Need to go back for the live entertainment in the evening … and definitely will.
Read more","Dined on October 3, 2023",5,5,4,5,the-pink-door,2023-10-03
"Fantastic food, fantastic service!  We will be back.","Dined on October 1, 2023",5,5,5,5,the-pink-door,2023-10-01
"I came here during my birthday weekend and I loved every moment of dining here. The food and our server was amazing. Additionally, they had a beautiful aerial show, which happened to be right next to our table and we were able to talk to the performer afterwards. Every time I come to Seattle, I will eat here. 10/10 🩷","Dined on October 1, 2023",5,5,5,5,the-pink-door,2023-10-01
"The experience is good. The food is just about average. I ordered their house antipasto and specifically asked for vegetarian, but it came with Tapanada that had anchovies. Their Arancini is good.
Main course was ok. I ordered their sausages and it was cooked nicely, but nothing to wow. Like I said go there for the experience, the live music, the aerial show, etc.
Read more","Dined on September 30, 2023",3,3,3,5,the-pink-door,2023-09-30
"Every single food that we ordered taste so good. Our server was very knowledgeable and always on top on all of our requests and orders. I forgot his name but thank you so much for your excellent service last night. This is our first time here and Im glad I brought the whole family to celebrate with us. We ordered these foods/drinks:

2 Italian sodas (cherry/almond and almond)
Lemonade (this was so refreshing!)

Antipasto of the house-full (4 people shared this and 🤌🏼)

PINK DOOR CAESAR
The grilled chicken was so soft  🤤
LINGUINE ALLE  VONGOLE
 (baby clams w/ shell and pasta. I didnt try this because Im allergic to shellfish but my husband said this is 🤌🏼 too)
LASAGNA PINK DOOR
 ( I wanted to order 5 or this thats how good it is 🤌🏼🤌🏼🤌🏼🤌🏼🤌🏼)
PAPPARDELLE AL RAGÙ BOLOGNESE
My least favorite but still taste good. I think my taste buds are so overwhelmed by the time Ive tried this that why. 
CIOPPINO PINK DOOR
If you love seafood and shellfish, this is the best as per my husband and in-laws.

My 3-year-old son also had linguine and red sauce with meatball and their TUSCAN FRIES & FRIED HERBS 🤌🏼

🤤THE BEST DESSERT EVER🤤
TOASTED ALMOND FLAVORED MOCHA AFFOGATO!

We will for sure come back and will try other food on their menu. I wanted to try them all last night 😅🤤
Read more","Dined on September 30, 2023",5,5,5,5,the-pink-door,2023-09-30
"Great place.  Super food.  Lovely service.
Looking forward to returning.","Dined on September 30, 2023",5,5,5,5,the-pink-door,2023-09-30
The Lasagna and cioppino were fantastic!! Oysters were so fresh and delicious! Loved the Ambience and great views of the sound.,"Dined on September 30, 2023",5,5,5,5,the-pink-door,2023-09-30
Very cool venue with delicious food. The Cesar salad and lasagna were great.,"Dined on September 29, 2023",5,5,5,5,the-pink-door,2023-09-29
"Honestly, for the effort it took to get a table here, we expected a little bit more, but overall it was a good experience. The only issue we had, was a very spicy mixed drink, and our waitress did not let me know the drink would be spicy when I ordered it. I was more disappointed in missing the live entertainment that they are known for. The dishes were great. The drinks were okay.. but it felt more like any other nice restaurant we had been to. I wouldn't bother with the effort of staying up late and planning ahead to make another reservation. I think expectation just beat out reality on this one, but the food was delicious, so you can't ever be too upset with that 😁
Read more","Dined on September 29, 2023",4,5,3,5,the-pink-door,2023-09-29
"Food and services fantastic. 
#1 place to eat in Seattle Washington .","Dined on September 29, 2023",5,5,5,5,the-pink-door,2023-09-29
I really appreciate the thoughtfulness that this restaurant has in giving a great experience. I scheduled a business meal here and it went exceptionally well all the was around in part because of the excellence service and delicious meals we received.,"Dined on September 29, 2023",5,4,5,5,the-pink-door,2023-09-29
Staff couldn’t have been kinder or more accommodating!,"Dined on September 28, 2023",5,5,5,5,the-pink-door,2023-09-28
"Food was amazing! We had a booth in the back dining room facing the water - great location.
Our server was good but one of the busboys had a bit of a condescending attitude. The  busboy that served the water was amazing! Such a hard worker!
The decor is eclectic and interesting!
Read more","Dined on September 28, 2023",5,5,4,5,the-pink-door,2023-09-28
Food portions are small but it’s a nice place to visit,"Dined on September 28, 2023",4,3,5,5,the-pink-door,2023-09-28
"The Pink Door is outstanding! Alicia was incredible .

Thank you","Dined on September 28, 2023",5,5,5,5,the-pink-door,2023-09-28
It was my first time at the restaurant and I’ve been hearing about how amazing this place is. It did not disappoint! Everything was amazing from food to service. I highly recommend to anyone!,"Dined on September 27, 2023",5,5,5,5,the-pink-door,2023-09-27
We were treated like royalty.  It was a perfect evening.,"Dined on September 27, 2023",5,5,5,5,the-pink-door,2023-09-27
"We had a fantastic time at the Pink Door for our 3rd year anniversary. Food was delicious, and possibly the best affogato that we’ve had in all of Seattle. The only nit with food was that there was quite a bit of sand in my linguine con vongole, which can certainly be improved. I was unable to try the cocktails due to having a cold, but I will definitely be back to try them out!","Dined on September 27, 2023",5,5,5,5,the-pink-door,2023-09-27
"Excellent experience at The Pink Door last night.  Our server was fun and knowledgeable.  The cocktails, food, and wine were great.  We will make this a regular on future Seattle trips.","Dined on September 27, 2023",5,5,5,5,the-pink-door,2023-09-27
Great atmosphere and delicious food. I ended up seated next to a local at the bar and had the best conversation!,"Dined on September 24, 2023",5,5,5,5,the-pink-door,2023-09-24
"Lovely restaurant, from the lively energy and decor.
We shared the meatballs for apertures and they were delicious!
A little bit on the expensive side for the food but overall great place to visit!","Dined on September 24, 2023",4,4,4,5,the-pink-door,2023-09-24
Absolutely loved my dinner and the whole experience of Pink Door! Be sure to make a reservation!,"Dined on September 24, 2023",5,5,5,5,the-pink-door,2023-09-24
Nice dinner and great service.  A bit pricey but the view and decor is lovely.,"Dined on September 24, 2023",4,4,5,5,the-pink-door,2023-09-24
"Amazing experience! Great quality food, stuff was super friendly and kind. Took my wife for or wedding anniversary. Requested a window seat on the spot, they promptly provided during even busy time. Recommend and will return again!","Dined on September 23, 2023",5,5,5,5,the-pink-door,2023-09-23
It was a good experience and great service but wait time to book the table can be reduced.,"Dined on September 23, 2023",4,3,4,4,the-pink-door,2023-09-23
"Loved the atmosphere and the drinks and food! We were visiting from Cincy!! Also, loved the view!!","Dined on September 23, 2023",5,5,5,5,the-pink-door,2023-09-23
Best meal and service in Seattle. Perfect atmosphere. Cannot recommend enough!,"Dined on September 23, 2023",5,5,5,5,the-pink-door,2023-09-23
"Had a delightful lunch, and were lucky enough to be seated outside on the patio on a gloriously sunny fall day (because today is le equinox)!","Dined on September 23, 2023",5,5,5,5,the-pink-door,2023-09-23
"Awesome restaurant with wonderful ambiance, food and service. Truly an enjoyable evening!","Dined on September 22, 2023",5,5,5,5,the-pink-door,2023-09-22
Maybe people come for the entertainment because the food was just ok. Great outdoor patio but make sure you come for the show. The food isn’t anything to write home about.,"Dined on September 22, 2023",3,3,4,4,the-pink-door,2023-09-22
"Bright fresh menu, great views, wonderful atmosphere. 10/10 would come again.","Dined on September 22, 2023",5,5,5,5,the-pink-door,2023-09-22
I always try to walk a fine lunch here when I’m in town￼,"Dined on September 22, 2023",5,5,5,5,the-pink-door,2023-09-22
Such a great experience every time. I always feel fortunate to get a table!,"Dined on September 21, 2023",5,5,5,5,the-pink-door,2023-09-21
Friendly staff and very delicious food. You can taste how fresh the ingredients is,"Dined on September 21, 2023",5,5,5,5,the-pink-door,2023-09-21
"It’s not really worth the hype. The space is really beautiful! Get a drink and call it a night… the food was meh.
Service was excellent.","Dined on September 21, 2023",3,3,5,5,the-pink-door,2023-09-21
"Our brunch experience was perfect from start to finish. Our server was knowledgeable about the menu and very positive energy.  The crudo and the Caesar salad with crab was as good as any of the 4 have ever had.  The bottles of wine were priced fairly and the entrees were diverse but wonderful across the board, lasagna, papradelle with bolognese, ciopino were all fantastic.  We finished with a shared butterscotch desert and Spanish coffee which were great.  The meal, the atmosphere and the service were 5 star from start to finish.  
I have no trouble leaving a poor review if merited but this place is one that you must visit if in Seattle.
Read more","Dined on September 21, 2023",5,5,5,5,the-pink-door,2023-09-21
"Reservation at 9 pm. We were early by 20 minutes but were seated immediately.  The ambiance perfect. Our food was delicious. Started with bruschetta with delicious tomato flavors, cioppino (seafood) and steak for husband which were well made. We finished with butterscotch desert and wine.  Our evening was perfect","Dined on September 20, 2023",5,5,5,5,the-pink-door,2023-09-20
Great experience for our anniversary! Service and ambiance were fantastic and the food was great as always. Definitely recomen for special occasions,"Dined on September 20, 2023",5,5,5,5,the-pink-door,2023-09-20
A must place to go when in Seattle. Very cool experience. Food was good. Request a seat in the lounge.,"Dined on September 20, 2023",5,4,4,5,the-pink-door,2023-09-20
The food was delicious but the portions were on the small side for the price. I loved the decor and atmosphere of the restaurant. We sat outside on the patio and it was nice to have a pleasant breeze during our lunch.,"Dined on September 20, 2023",5,5,5,5,the-pink-door,2023-09-20
A real treat!  Favorite place to bring out of town guests!,"Dined on September 19, 2023",5,5,5,5,the-pink-door,2023-09-19
Food was absolutely fantastic. Best Italian food in Seattle! Make a reservation!,"Dined on September 17, 2023",5,5,4,5,the-pink-door,2023-09-17
"We actually made the trip specifically to go to this restaurant as we were celebrating a special occasion ￼and made the reservation over a month in advance. The majority of our food was good. The raspberry basil cake is amazing! The trapeze artist was wonderful! ￼We were a little disappointed in the service we received. But perhaps our server was not having a good night. If we’re in Seattle again, will definitely give it another try!
Read more","Dined on September 17, 2023",4,4,3,5,the-pink-door,2023-09-17
The best dining experience in its class. Highly recommend,"Dined on September 17, 2023",5,5,5,5,the-pink-door,2023-09-17
"I strongly suggest you reserve in advance because it is a very popular place although there is a “walk in” line the waiting line is long and you might end disappointed because there are limited spaces. I used Open Table App.

When looking for the place, beware that it might a bit challenging to find because there are no outside signs or any kind of identification… just a Pink Door.

Food is amazing!
I had the Pink Door Lasagna… strongly recommended also the Basil Cake was really good!

Weather was nice so sat outside. Great experience!

Service was excellent! Staff is very kind and attentive.
Food came out at reasonable time.

If you want to have a wonderful experience in Seattle… this is the place!
Read more","Dined on September 17, 2023",5,5,5,5,the-pink-door,2023-09-17
The food was great. The only place in Seattle that serves squid ink pasta with 5 star rating.🥰,"Dined on September 17, 2023",5,5,5,5,the-pink-door,2023-09-17
"The venue and location was very very nice our waitress, her name was olga, started out the evening super Pleasant and extremely inviting but as the evening continued for whatever reason that turned a little South. It took a long time for our food to finally come out it was okay but nothing over the top to get excited about","Dined on September 16, 2023",2,3,2,5,the-pink-door,2023-09-16
"One of the best dinners we have had in a long time. The food was amazing, our server Ryan was superb and the atmosphere was warm and cozy.","Dined on September 16, 2023",5,5,4,5,the-pink-door,2023-09-16
"We were disappointed that there was no burlesque show after trying to get reservations for two months. It was a special anniversary dinner evening, and then the food was just fair, nothing special. The ambiance is great but not worth the hassle of waiting for a reservation. We may try again, it seems impossible to get a Saturday night reservation to see the entertainment.","Dined on September 16, 2023",2,2,3,1,the-pink-door,2023-09-16
Beautiful dinner at the Pink Door! Exceptional waitstaff and delicious food.,"Dined on September 16, 2023",5,5,5,5,the-pink-door,2023-09-16
Loved this restaurant for years it never fails to amaze me!,"Dined on September 16, 2023",5,5,5,5,the-pink-door,2023-09-16
WOW just amazing all around. Definitely a gem. So happy to have come across it during my travel planning,"Dined on September 15, 2023",5,5,5,5,the-pink-door,2023-09-15
"Our Waiter was nice, funny, and attentive. Kince was awesome and funny. Food was amazing. It's a vibe!","Dined on September 15, 2023",5,5,5,5,the-pink-door,2023-09-15
"Absolutely 
My all time favorite place
Went in March for my 80th bday
& eat inside 
& Sept for our 60th anniversary & sat on the deck for an awesome day! 
I’ve taken my girls friends every August for lunch (before covid)
I always recommend PD
Read more","Dined on September 15, 2023",5,5,5,5,the-pink-door,2023-09-15
"Difficult to find the front door, pink door with no sign in an alley, not amenable for the handicapped or Thais having difficulty going up/down stairs, eclectic ambiance, decent service but excellent, high quality Italian fare","Dined on September 15, 2023",5,5,4,4,the-pink-door,2023-09-15
Got seats near the window. Beautiful view and great food! Definitely worth visiting.,"Dined on September 14, 2023",5,5,5,5,the-pink-door,2023-09-14
"We arrived 20 minutes early for our reservation and got seated right away in the area we wanted! The service was incredible - our server was Alissa - we LOVED her. she was super helpful with the drink menu and answering any questions we had. The food was delicious, and any time out water ran out it was refilled immediately. We had a group behind us that was so loud it made it hard for us to hear each other, but once they left the place mellowed out and was a lot more enjoyable.
Read more","Dined on September 14, 2023",5,5,5,4,the-pink-door,2023-09-14
Highly recommend getting a reservation as it is a busy restaurant. Only take reservations though 30 days ahead… worth the effort! Food is so good. We had the signature lasagna and Cesar salad and both commented was some of the best we have ever eaten.  Prices consistent with similar Seattle restaurants,"Dined on September 14, 2023",5,5,5,5,the-pink-door,2023-09-14
The best service food and atmosphere. If only it was easier to get a table.,"Dined on September 14, 2023",5,5,5,5,the-pink-door,2023-09-14
"The food was just ok, but the setting, view and ambiance are awesome.","Dined on September 14, 2023",4,2,4,5,the-pink-door,2023-09-14
Restaurant interior is very eclectic!  Dinner was good and server was excellent!,"Dined on September 14, 2023",5,5,5,5,the-pink-door,2023-09-14
Lunch for 5 took 2.5 hrs.. and wasn’t due to drinks…. Food was good but incredibly slow… waitress likely had too many tables and wasn’t anticipating.,"Dined on September 14, 2023",4,4,3,5,the-pink-door,2023-09-14
I love this restaurant! However it was the first time I had to ask for salt to season the risotto 😢,"Dined on September 14, 2023",5,4,4,5,the-pink-door,2023-09-14
"Front desk had a hard time finding my reservation. Showed them the confirmation message, but still could not find it.","Dined on September 13, 2023",4,5,4,4,the-pink-door,2023-09-13
Amazing Italian!!!  Beautiful view of the sound. Staff were fantastic.  Make a reservation.  Well worth it,"Dined on September 13, 2023",5,5,5,5,the-pink-door,2023-09-13
Dan was his usual competent and enjoyable self.  The linguine vogole was to die for.,"Dined on September 12, 2023",5,5,5,5,the-pink-door,2023-09-12
Absolutely delicious food with amazing service. Our waitress was able to recommend options from appetizer to dessert.,"Dined on September 10, 2023",5,5,5,5,the-pink-door,2023-09-10
"Very popular place, had to book exactly 30 days in advance to get our reservation.  We were there for our anniversary with friends and we couldn’t have been more pleased.  Drinks, appetizers and entrees were all outstanding.  Service was impeccable, his timing was perfect, we were not rushed but he was there when we needed him.  

We ate in the main dining room, so did not catch the show which takes place in the lounge area.  That looks entertaining, but from the main dining room you have the amazing water view and sunset.  Different types of awesome!

The only thing that we were only very slightly disappointed with, were the dessert choices.  What we chose, to share as a table four (so full) was the basil cake which was good.  We’re all chocolate lovers, and so no options.

Highly recommend, but getting there can be difficult right now due to all of the surrounding construction.  Enjoy!!!
Read more","Dined on September 10, 2023",5,5,5,5,the-pink-door,2023-09-10
"Everything was so on point. The food was excellent. The service was excellent. The atmosphere was fun and professional. 

People who own or manage restaurants should try to inspire to be this good. 

Make your reservations and experience this wonderful restaurant.
Read more","Dined on September 10, 2023",5,5,5,5,the-pink-door,2023-09-10
Request a table outside if it’s nice. And order the fries as an appetizer,"Dined on September 10, 2023",5,4,4,5,the-pink-door,2023-09-10
"Salmon was the fish of the day, very good but slightly over salted. Pink door Lasagna was delicious.","Dined on September 10, 2023",5,5,4,4,the-pink-door,2023-09-10
Amazing setting. Unique. Great service and overall customer care. My wife’s fig and cheese dish was very good. My Caesar salad with crab was only so so. The crab had a very strong smell. I would recommend the Pink Door. Just not the Caesar with crab.,"Dined on September 10, 2023",4,3,5,5,the-pink-door,2023-09-10
It was so delicious! Came…not wearing tourist sneakers and we did just great!,"Dined on September 10, 2023",5,5,5,5,the-pink-door,2023-09-10
Staff was friendly and amazing. Hard to get a reservation but glad we got a lunch reservation on the patio on a nice summer day,"Dined on September 9, 2023",5,5,5,5,the-pink-door,2023-09-09
the food was divine!! i loved the presentation and timing of all the courses. i only wish the ambience of the outdoor area felt the same as the indoor part of the restaurant. the tablecloths felt a little kitchy and didn’t seem to match the vibe,"Dined on September 9, 2023",5,5,5,4,the-pink-door,2023-09-09
